{"created_at":"2026-09-02T00:00:00Z","created_by_profile_id":"codex-control-v1","edges":[{"edge_type":"DEPENDS_ON","from_node_id":"deliverable-c-model-registry","to_node_id":"deliverable-c-model-registry-review"},{"edge_type":"DEPENDS_ON","from_node_id":"deliverable-c-model-registry-review","to_node_id":"deliverable-c-model-registry-integration"}],"graph_id":"deliverable-c-model-registry-graph","nodes":[{"manifest_sha256":"016a098bca9ee43b3eaf3aa82cdac4e4f3a7937479d470ae6f1b44ba92f5b558","node_id":"deliverable-c-model-registry","node_type":"BuildTask"},{"manifest_sha256":"016a098bca9ee43b3eaf3aa82cdac4e4f3a7937479d470ae6f1b44ba92f5b558","node_id":"deliverable-c-model-registry-review","node_type":"Review"},{"manifest_sha256":"016a098bca9ee43b3eaf3aa82cdac4e4f3a7937479d470ae6f1b44ba92f5b558","node_id":"deliverable-c-model-registry-integration","node_type":"Integration"}],"protocol":"helios.build.graph-manifest/v1"}