{"created_at":"2026-09-01T16:23:52Z","created_by_profile_id":"codex-control-v1","edges":[{"edge_type":"DEPENDS_ON","from_node_id":"task9-build-fabric-core-code","to_node_id":"task9-build-fabric-core-code-review"},{"edge_type":"DEPENDS_ON","from_node_id":"task9-build-fabric-core-code-review","to_node_id":"task9-build-fabric-core-code-integration"}],"graph_id":"task-9-build-fabric-core-code-graph","nodes":[{"manifest_sha256":"bc197ed65c19119a9a66fca50e7ea03dc5f266f67ffb0e448abf6919b8d3b56a","node_id":"task9-build-fabric-core-code","node_type":"BuildTask"},{"manifest_sha256":"bc197ed65c19119a9a66fca50e7ea03dc5f266f67ffb0e448abf6919b8d3b56a","node_id":"task9-build-fabric-core-code-review","node_type":"Review"},{"manifest_sha256":"bc197ed65c19119a9a66fca50e7ea03dc5f266f67ffb0e448abf6919b8d3b56a","node_id":"task9-build-fabric-core-code-integration","node_type":"Integration"}],"protocol":"helios.build.graph-manifest/v1"}