{"created_at":"2026-09-01T17:40:30Z","created_by_profile_id":"codex-control-v1","edges":[{"edge_type":"DEPENDS_ON","from_node_id":"division23-v2-registry-spine-correction-1","to_node_id":"division23-v2-registry-spine-correction-1-review"},{"edge_type":"DEPENDS_ON","from_node_id":"division23-v2-registry-spine-correction-1-review","to_node_id":"division23-v2-registry-spine-correction-1-integration"}],"graph_id":"division23-v2-registry-spine-correction-1-graph","nodes":[{"manifest_sha256":"009fb2a8b371c83a089f25573e2818043f9dd7b18377b54fa73663c28a265fec","node_id":"division23-v2-registry-spine-correction-1","node_type":"BuildTask"},{"manifest_sha256":"009fb2a8b371c83a089f25573e2818043f9dd7b18377b54fa73663c28a265fec","node_id":"division23-v2-registry-spine-correction-1-review","node_type":"Review"},{"manifest_sha256":"009fb2a8b371c83a089f25573e2818043f9dd7b18377b54fa73663c28a265fec","node_id":"division23-v2-registry-spine-correction-1-integration","node_type":"Integration"}],"protocol":"helios.build.graph-manifest/v1"}