{"created_at":"2026-09-01T17:20:04.641675Z","created_by_profile_id":"codex-control-v1","edges":[{"edge_type":"DEPENDS_ON","from_node_id":"division23-v2-registry-spine","to_node_id":"division23-v2-registry-spine-review"},{"edge_type":"DEPENDS_ON","from_node_id":"division23-v2-registry-spine-review","to_node_id":"division23-v2-registry-spine-integration"}],"graph_id":"division23-v2-registry-spine-graph","nodes":[{"manifest_sha256":"af00422557e8eb5bf06b99dfde8c6777d23f8af5c8f760d6bcbc853d2699f486","node_id":"division23-v2-registry-spine","node_type":"BuildTask"},{"manifest_sha256":"af00422557e8eb5bf06b99dfde8c6777d23f8af5c8f760d6bcbc853d2699f486","node_id":"division23-v2-registry-spine-review","node_type":"Review"},{"manifest_sha256":"af00422557e8eb5bf06b99dfde8c6777d23f8af5c8f760d6bcbc853d2699f486","node_id":"division23-v2-registry-spine-integration","node_type":"Integration"}],"protocol":"helios.build.graph-manifest/v1"}