{
  "protocol": "helios.build.graph-manifest/v1",
  "graph_id": "division23-v2-calculation-assembly-kernel-graph",
  "created_at": "2026-09-01T18:31:30Z",
  "created_by_profile_id": "codex-control-v1",
  "nodes": [
    {
      "node_id": "division23-v2-calculation-assembly-kernel",
      "node_type": "BuildTask",
      "manifest_sha256": "54cf68822cc8e4f42a0f2e095ee8be55854f51a594bfd1fd9d93e188fd83b164"
    },
    {
      "node_id": "division23-v2-calculation-assembly-kernel-review",
      "node_type": "Review",
      "manifest_sha256": "54cf68822cc8e4f42a0f2e095ee8be55854f51a594bfd1fd9d93e188fd83b164"
    },
    {
      "node_id": "division23-v2-calculation-assembly-kernel-integration",
      "node_type": "Integration",
      "manifest_sha256": "54cf68822cc8e4f42a0f2e095ee8be55854f51a594bfd1fd9d93e188fd83b164"
    }
  ],
  "edges": [
    {
      "edge_type": "DEPENDS_ON",
      "from_node_id": "division23-v2-calculation-assembly-kernel",
      "to_node_id": "division23-v2-calculation-assembly-kernel-review"
    },
    {
      "edge_type": "DEPENDS_ON",
      "from_node_id": "division23-v2-calculation-assembly-kernel-review",
      "to_node_id": "division23-v2-calculation-assembly-kernel-integration"
    }
  ]
}
