{"created_at":"2026-09-01T17:56:30Z","created_by_profile_id":"codex-control-v1","edges":[{"edge_type":"DEPENDS_ON","from_node_id":"athena-source-packet-intake-r1a","to_node_id":"athena-source-packet-intake-r1a-review"},{"edge_type":"DEPENDS_ON","from_node_id":"athena-source-packet-intake-r1a-review","to_node_id":"athena-source-packet-intake-r1a-integration"}],"graph_id":"athena-source-packet-intake-r1a-graph","nodes":[{"manifest_sha256":"8efeed58f367f6984fea4fe3d33c41e27599246011eed26c99219e04caa58979","node_id":"athena-source-packet-intake-r1a","node_type":"BuildTask"},{"manifest_sha256":"8efeed58f367f6984fea4fe3d33c41e27599246011eed26c99219e04caa58979","node_id":"athena-source-packet-intake-r1a-review","node_type":"Review"},{"manifest_sha256":"8efeed58f367f6984fea4fe3d33c41e27599246011eed26c99219e04caa58979","node_id":"athena-source-packet-intake-r1a-integration","node_type":"Integration"}],"protocol":"helios.build.graph-manifest/v1"}