{"created_at":"2026-09-01T17:03:03.884550Z","created_by_profile_id":"codex-control-v1","edges":[{"edge_type":"DEPENDS_ON","from_node_id":"task9c-build-fabric-core-code","to_node_id":"task9c-build-fabric-core-code-review"},{"edge_type":"DEPENDS_ON","from_node_id":"task9c-build-fabric-core-code-review","to_node_id":"task9c-build-fabric-core-code-integration"}],"graph_id":"task-9-build-fabric-core-code-final-graph","nodes":[{"manifest_sha256":"3993b8d0bfa76bd18b49b0054d868f073e5404cebcfccd60e4c5565ce0a8f0e9","node_id":"task9c-build-fabric-core-code","node_type":"BuildTask"},{"manifest_sha256":"3993b8d0bfa76bd18b49b0054d868f073e5404cebcfccd60e4c5565ce0a8f0e9","node_id":"task9c-build-fabric-core-code-review","node_type":"Review"},{"manifest_sha256":"3993b8d0bfa76bd18b49b0054d868f073e5404cebcfccd60e4c5565ce0a8f0e9","node_id":"task9c-build-fabric-core-code-integration","node_type":"Integration"}],"protocol":"helios.build.graph-manifest/v1"}