{"created_at":"2026-09-01T16:45:02.195701Z","created_by_profile_id":"codex-control-v1","edges":[{"edge_type":"DEPENDS_ON","from_node_id":"task9r1-build-fabric-core-code","to_node_id":"task9r1-build-fabric-core-code-review"},{"edge_type":"DEPENDS_ON","from_node_id":"task9r1-build-fabric-core-code-review","to_node_id":"task9r1-build-fabric-core-code-integration"}],"graph_id":"task-9-build-fabric-core-code-rebased-1-graph","nodes":[{"manifest_sha256":"c1c0e67a963c90985a5dae08fead23ed1e204e8a5cc51148e7abe11d54ba9c4f","node_id":"task9r1-build-fabric-core-code","node_type":"BuildTask"},{"manifest_sha256":"c1c0e67a963c90985a5dae08fead23ed1e204e8a5cc51148e7abe11d54ba9c4f","node_id":"task9r1-build-fabric-core-code-review","node_type":"Review"},{"manifest_sha256":"c1c0e67a963c90985a5dae08fead23ed1e204e8a5cc51148e7abe11d54ba9c4f","node_id":"task9r1-build-fabric-core-code-integration","node_type":"Integration"}],"protocol":"helios.build.graph-manifest/v1"}