{"created_at":"2026-09-02T00:00:00Z","created_by_profile_id":"codex-control-v1","edges":[{"edge_type":"DEPENDS_ON","from_node_id":"deliverable-e-local-service-sdk-task-1","to_node_id":"deliverable-e-local-service-sdk-task-1-review"},{"edge_type":"DEPENDS_ON","from_node_id":"deliverable-e-local-service-sdk-task-1-review","to_node_id":"deliverable-e-local-service-sdk-task-1-integration"}],"graph_id":"deliverable-e-local-service-sdk-graph","nodes":[{"manifest_sha256":"5ac01bd9ce2e8b0a6f1ac43345de360b43fc3880bbd1c48ecf7f2848a1045517","node_id":"deliverable-e-local-service-sdk-task-1","node_type":"BuildTask"},{"manifest_sha256":"5ac01bd9ce2e8b0a6f1ac43345de360b43fc3880bbd1c48ecf7f2848a1045517","node_id":"deliverable-e-local-service-sdk-task-1-review","node_type":"Review"},{"manifest_sha256":"5ac01bd9ce2e8b0a6f1ac43345de360b43fc3880bbd1c48ecf7f2848a1045517","node_id":"deliverable-e-local-service-sdk-task-1-integration","node_type":"Integration"}],"protocol":"helios.build.graph-manifest/v1"}