{"created_at":"2026-09-01T18:02:30Z","created_by_profile_id":"codex-control-v1","edges":[{"edge_type":"DEPENDS_ON","from_node_id":"division23-v2-registry-hardening-final","to_node_id":"division23-v2-registry-hardening-final-review"},{"edge_type":"DEPENDS_ON","from_node_id":"division23-v2-registry-hardening-final-review","to_node_id":"division23-v2-registry-hardening-final-integration"}],"graph_id":"division23-v2-registry-hardening-final-graph","nodes":[{"manifest_sha256":"4d86abcf67e37d724b8def4ac1e4682f7d90a131a75fd3ff9997ab7161e90835","node_id":"division23-v2-registry-hardening-final","node_type":"BuildTask"},{"manifest_sha256":"4d86abcf67e37d724b8def4ac1e4682f7d90a131a75fd3ff9997ab7161e90835","node_id":"division23-v2-registry-hardening-final-review","node_type":"Review"},{"manifest_sha256":"4d86abcf67e37d724b8def4ac1e4682f7d90a131a75fd3ff9997ab7161e90835","node_id":"division23-v2-registry-hardening-final-integration","node_type":"Integration"}],"protocol":"helios.build.graph-manifest/v1"}